{
  "schema_id": "asklegal.hk-regulatory.rendering-decision-report",
  "schema_version": "1.0.0",
  "rule_id": "HKREG-RENDERING-DECISION-001",
  "case_id": "HKREG-DET-RND-013",
  "assertion_scope": "ORDINARY",
  "observed_decision": {
    "schema_id": "asklegal.hk-regulatory.rendering-decision-result",
    "schema_version": "1.0.0",
    "rule_id": "HKREG-RENDERING-DECISION-001",
    "case_id": "HKREG-DET-RND-013",
    "outcome": "PASS",
    "reason": "FORBIDDEN_CONTENT_EXCLUDED",
    "canonical_text": "Context:\nMaterial: HKEX Listing Rule — non-statutory exchange regulatory rule\nMarket: Main Board\nComponent: Synthetic Main Board Listing Rules\nLocation: Rule 2.01\n\nEnglish rule text — prevailing language:\n2.01 An issuer must comply with the Listing Rules.",
    "authority_note": "None",
    "embedding_input": "Context:\nMaterial: HKEX Listing Rule — non-statutory exchange regulatory rule\nMarket: Main Board\nComponent: Synthetic Main Board Listing Rules\nLocation: Rule 2.01\n\nEnglish rule text — prevailing language:\n2.01 An issuer must comply with the Listing Rules.",
    "text_tokens": 255,
    "metadata_bytes": 395,
    "text_limit": 10000,
    "metadata_limit": 20000,
    "fits": true,
    "omitted_element_ids": [],
    "rejected_element_ids": [
      "source-url",
      "web-control"
    ],
    "quarantined_element_ids": [],
    "identity_consequence": "NOT_EVALUATED",
    "vector_responsibility": "ONE_ENGLISH_TEXT",
    "search_record_authorized": false,
    "embedding_authorized": false,
    "release_authorized": false,
    "serving_authorized": false,
    "external_effects": "NONE"
  },
  "expected_decision": {
    "schema_id": "asklegal.hk-regulatory.rendering-decision-result",
    "schema_version": "1.0.0",
    "rule_id": "HKREG-RENDERING-DECISION-001",
    "case_id": "HKREG-DET-RND-013",
    "outcome": "PASS",
    "reason": "FORBIDDEN_CONTENT_EXCLUDED",
    "canonical_text": "Context:\nMaterial: HKEX Listing Rule — non-statutory exchange regulatory rule\nMarket: Main Board\nComponent: Synthetic Main Board Listing Rules\nLocation: Rule 2.01\n\nEnglish rule text — prevailing language:\n2.01 An issuer must comply with the Listing Rules.",
    "authority_note": "None",
    "embedding_input": "Context:\nMaterial: HKEX Listing Rule — non-statutory exchange regulatory rule\nMarket: Main Board\nComponent: Synthetic Main Board Listing Rules\nLocation: Rule 2.01\n\nEnglish rule text — prevailing language:\n2.01 An issuer must comply with the Listing Rules.",
    "text_tokens": 255,
    "metadata_bytes": 395,
    "text_limit": 10000,
    "metadata_limit": 20000,
    "fits": true,
    "omitted_element_ids": [],
    "rejected_element_ids": [
      "source-url",
      "web-control"
    ],
    "quarantined_element_ids": [],
    "identity_consequence": "NOT_EVALUATED",
    "vector_responsibility": "ONE_ENGLISH_TEXT",
    "search_record_authorized": false,
    "embedding_authorized": false,
    "release_authorized": false,
    "serving_authorized": false,
    "external_effects": "NONE"
  },
  "conformance_status": "PASS",
  "source_authorized": false,
  "provider_authorized": false,
  "release_authorized": false,
  "serving_authorized": false,
  "deployment_authorized": false,
  "external_effects": "NONE"
}
