{
  "schema_id": "asklegal.hk-regulatory.rendering-decision-report",
  "schema_version": "1.0.0",
  "rule_id": "HKREG-RENDERING-DECISION-001",
  "case_id": "HKREG-DET-RND-028",
  "assertion_scope": "FORM",
  "observed_decision": {
    "schema_id": "asklegal.hk-regulatory.rendering-decision-result",
    "schema_version": "1.0.0",
    "rule_id": "HKREG-RENDERING-DECISION-001",
    "case_id": "HKREG-DET-RND-028",
    "outcome": "BLOCK",
    "reason": "FORM_FRAGMENTATION_REJECTED",
    "canonical_text": null,
    "authority_note": null,
    "embedding_input": null,
    "text_tokens": null,
    "metadata_bytes": null,
    "text_limit": null,
    "metadata_limit": null,
    "fits": null,
    "omitted_element_ids": [],
    "rejected_element_ids": [
      "field-group",
      "instruction"
    ],
    "quarantined_element_ids": [],
    "identity_consequence": "NOT_EVALUATED",
    "vector_responsibility": "NONE",
    "search_record_authorized": false,
    "embedding_authorized": false,
    "release_authorized": false,
    "serving_authorized": false,
    "external_effects": "NONE"
  },
  "expected_decision": {
    "schema_id": "asklegal.hk-regulatory.rendering-decision-result",
    "schema_version": "1.0.0",
    "rule_id": "HKREG-RENDERING-DECISION-001",
    "case_id": "HKREG-DET-RND-028",
    "outcome": "BLOCK",
    "reason": "FORM_FRAGMENTATION_REJECTED",
    "canonical_text": null,
    "authority_note": null,
    "embedding_input": null,
    "text_tokens": null,
    "metadata_bytes": null,
    "text_limit": null,
    "metadata_limit": null,
    "fits": null,
    "omitted_element_ids": [],
    "rejected_element_ids": [
      "field-group",
      "instruction"
    ],
    "quarantined_element_ids": [],
    "identity_consequence": "NOT_EVALUATED",
    "vector_responsibility": "NONE",
    "search_record_authorized": false,
    "embedding_authorized": false,
    "release_authorized": false,
    "serving_authorized": false,
    "external_effects": "NONE"
  },
  "conformance_status": "PASS",
  "source_authorized": false,
  "provider_authorized": false,
  "release_authorized": false,
  "serving_authorized": false,
  "deployment_authorized": false,
  "external_effects": "NONE"
}
